{
  "unit": "m",
  "metadata": {
    "name": "45sqm_one_bedroom",
    "source_prompt": "生成一个45平米一居室，有卧室、客厅、开放式厨房、卫生间",
    "area_sqm": 45,
    "style": "simple_placeholder"
  },
  "rooms": [
    {
      "id": "living",
      "name": "客厅",
      "type": "living_room",
      "polygon": [[0, 0], [4.2, 0], [4.2, 4.6], [0, 4.6]],
      "height": 2.8
    },
    {
      "id": "kitchen",
      "name": "开放式厨房",
      "type": "kitchen",
      "polygon": [[4.2, 0], [6.7, 0], [6.7, 2.4], [4.2, 2.4]],
      "height": 2.8
    },
    {
      "id": "bath",
      "name": "卫生间",
      "type": "bathroom",
      "polygon": [[4.2, 2.4], [6.7, 2.4], [6.7, 4.6], [4.2, 4.6]],
      "height": 2.8
    },
    {
      "id": "bedroom",
      "name": "卧室",
      "type": "bedroom",
      "polygon": [[0, 4.6], [6.7, 4.6], [6.7, 6.72], [0, 6.72]],
      "height": 2.8
    }
  ],
  "walls": [
    { "id": "w_south", "start": [0, 0], "end": [6.7, 0], "height": 2.8, "thickness": 0.16, "kind": "exterior" },
    { "id": "w_east", "start": [6.7, 0], "end": [6.7, 6.72], "height": 2.8, "thickness": 0.16, "kind": "exterior" },
    { "id": "w_north", "start": [6.7, 6.72], "end": [0, 6.72], "height": 2.8, "thickness": 0.16, "kind": "exterior" },
    { "id": "w_west", "start": [0, 6.72], "end": [0, 0], "height": 2.8, "thickness": 0.16, "kind": "exterior" },
    { "id": "w_bed_living", "start": [0, 4.6], "end": [6.7, 4.6], "height": 2.8, "thickness": 0.12, "kind": "interior" },
    { "id": "w_living_service", "start": [4.2, 0], "end": [4.2, 4.6], "height": 2.8, "thickness": 0.12, "kind": "interior" },
    { "id": "w_kitchen_bath", "start": [4.2, 2.4], "end": [6.7, 2.4], "height": 2.8, "thickness": 0.12, "kind": "interior" }
  ],
  "doors": [
    { "id": "d_entry", "wall_id": "w_south", "center": [1.1, 0], "width": 0.9, "height": 2.1, "sill_height": 0, "swing": "left" },
    { "id": "d_bedroom", "wall_id": "w_bed_living", "center": [1.2, 4.6], "width": 0.8, "height": 2.1, "sill_height": 0, "swing": "right" },
    { "id": "d_bath", "wall_id": "w_kitchen_bath", "center": [5.45, 2.4], "width": 0.75, "height": 2.1, "sill_height": 0, "swing": "left" }
  ],
  "windows": [
    { "id": "win_living", "wall_id": "w_west", "center": [0, 2.5], "width": 1.6, "height": 1.2, "sill_height": 0.9, "swing": "none" },
    { "id": "win_bedroom", "wall_id": "w_north", "center": [3.5, 6.72], "width": 2.0, "height": 1.2, "sill_height": 0.9, "swing": "none" },
    { "id": "win_kitchen", "wall_id": "w_east", "center": [6.7, 1.2], "width": 1.1, "height": 1.0, "sill_height": 1.1, "swing": "none" }
  ],
  "furniture": [
    { "id": "sofa", "type": "sofa", "room_id": "living", "position": [1.8, 2.4, 0.35], "size": [2.0, 0.85, 0.7], "rotation_deg": 0, "label": "沙发" },
    { "id": "coffee_table", "type": "table", "room_id": "living", "position": [1.8, 1.35, 0.25], "size": [1.0, 0.55, 0.5], "rotation_deg": 0, "label": "茶几" },
    { "id": "tv", "type": "tv_console", "room_id": "living", "position": [3.75, 2.1, 0.35], "size": [0.25, 1.4, 0.7], "rotation_deg": 90, "label": "电视柜" },
    { "id": "kitchen_counter", "type": "counter", "room_id": "kitchen", "position": [5.45, 0.45, 0.45], "size": [2.2, 0.6, 0.9], "rotation_deg": 0, "label": "橱柜" },
    { "id": "bed", "type": "bed", "room_id": "bedroom", "position": [2.0, 5.75, 0.3], "size": [2.0, 1.5, 0.6], "rotation_deg": 0, "label": "床" },
    { "id": "wardrobe", "type": "wardrobe", "room_id": "bedroom", "position": [5.7, 5.35, 1.05], "size": [0.6, 1.8, 2.1], "rotation_deg": 0, "label": "衣柜" },
    { "id": "toilet", "type": "toilet", "room_id": "bath", "position": [5.95, 3.75, 0.35], "size": [0.45, 0.7, 0.7], "rotation_deg": 0, "label": "马桶" },
    { "id": "shower", "type": "shower", "room_id": "bath", "position": [4.75, 3.65, 1.0], "size": [0.9, 0.9, 2.0], "rotation_deg": 0, "label": "淋浴" }
  ]
}
